,Family,Subfamily,Type enzyme,Group
331,T2,,glycosylasparaginase precursor (Homo sapiens),Threonine (T) Peptidase
332,T3,,gamma-glutamyltransferase 1  (Escherichia coli),Threonine (T) Peptidase
333,T5,,ornithine acetyltransferase precursor (Saccharomyces cerevisiae),Threonine (T) Peptidase
334,T7,,CwpV  self-cleaving threonine peptidase (Peptoclostridium difficile),Threonine (T) Peptidase
335,T8,,HopB1 g.p.  (Pseudomonas syringae),Threonine (T) Peptidase
336,U32,,collagenase  (Porphyromonas gingivalis),Peptidase of Unknown Catalytic Type
337,U40,,protein P5 murein endopeptidase  (bacteriophage phi-6),Peptidase of Unknown Catalytic Type
338,U49,,Lit peptidase (Escherichia coli),Peptidase of Unknown Catalytic Type
339,U56,,homomultimeric peptidase (Thermotoga maritima),Peptidase of Unknown Catalytic Type
340,U57,,yabG protein  (Bacillus subtilis),Peptidase of Unknown Catalytic Type
341,U69,,AIDA-I self-cleaving autotransporter protein  (Escherichia coli),Peptidase of Unknown Catalytic Type
342,U72,,Dop isopeptidase (Mycobacterium tuberculosis),Peptidase of Unknown Catalytic Type
343,U74,,neprosin (Nepenthes ventrata),Peptidase of Unknown Catalytic Type
344,U75,,Ras/Rap1-specific peptidase (Vibrio vulnificus),Peptidase of Unknown Catalytic Type
